{
  "id": "EPISODIC-001",
  "schema_version": "0.1",
  "title": "The celebration dinner at Marlowe's, three weeks later",
  "category": "episodic",
  "dimension": "episodic_recall",
  "secondary_dimensions": ["contextual_memory", "memory_relevance"],
  "tags": ["delayed-recall", "event"],
  "difficulty": "medium",
  "recall_type": "contextual",
  "session_condition": "long_time_gap",
  "measures": "Delayed episodic recall used in context. The probe never asks 'what happened at Marlowe's?'. It mentions the place in passing, and a strong system brings back the specific event (a celebration dinner) and its useful details (the risotto was too salty; the user wanted to try the gnocchi next time) because they bear on the user's current decision.",
  "character": {
    "name": "Theo",
    "description": "The user's easygoing, food-loving friend character who likes swapping restaurant opinions.",
    "traits": ["easygoing", "enthusiastic about food", "good listener"],
    "speech_style": "Casual, upbeat, short sentences."
  },
  "user_profile": {
    "event": "Celebrated a job offer at Marlowe's, an Italian restaurant",
    "detail_1": "Risotto was too salty",
    "detail_2": "Wanted to try the gnocchi next time"
  },
  "sessions": [
    { "session": 1, "simulated_time": "P0D", "label": "Night of the dinner" },
    { "session": 2, "simulated_time": "P1W", "label": "Unrelated chat" },
    { "session": 3, "simulated_time": "P3W", "label": "Weekend plans" }
  ],
  "setup": [
    { "turn": 1, "session": 1, "event": "User tells Theo they just celebrated a new job offer with dinner at Marlowe's." },
    { "turn": 2, "session": 1, "event": "User says the risotto was too salty but the place was lovely, and they want to try the gnocchi next time." }
  ],
  "history": [
    { "turn": 1, "session": 1, "role": "user", "content": "Guess what. I got the job! We went to Marlowe's to celebrate, that Italian place on Fifth." },
    { "turn": 1, "session": 1, "role": "character", "content": "No way, congratulations! Marlowe's is a good call for a celebration. How was it?" },
    { "turn": 2, "session": 1, "role": "user", "content": "The place was lovely, candles everywhere. My risotto was way too salty though. Next time I'm getting the gnocchi, everyone at the next table was raving about it." },
    { "turn": 2, "session": 1, "role": "character", "content": "Ha, salty risotto on your big night. Gnocchi next time, noted." }
  ],
  "delay": {
    "turns": 40,
    "sessions": 2,
    "simulated_time": "P3W",
    "note": "Filler spread across sessions 1-3. Marlowe's, the job and food are not mentioned in filler."
  },
  "probe": {
    "type": "contextual",
    "session": 3,
    "prompt": "My parents are visiting this weekend and I'm thinking about taking them to Marlowe's. Thoughts?",
    "opportunity": "Bring back the celebration dinner and the risotto/gnocchi details because they are relevant to the decision."
  },
  "expected": {
    "memory": [
      "user celebrated their job offer at Marlowe's",
      "the risotto was too salty",
      "user wanted to try the gnocchi"
    ],
    "behavior": [
      "connects Marlowe's to the earlier celebration without being asked",
      "uses at least one specific detail (risotto or gnocchi) in a way that helps the decision",
      "treats the memory as shared history, not as a retrieved record"
    ],
    "must_not": [
      "responds as if Marlowe's is unfamiliar",
      "invents details that were not said (e.g. bad service, a different dish)"
    ]
  },
  "failure_modes": ["episodic_forgetting", "memory_nonuse", "false_memory"],
  "scoring": {
    "scale": "0-5",
    "rubric": {
      "0": "Invents a contradictory memory of Marlowe's (e.g. 'you said you hated it').",
      "1": "Treats Marlowe's as unfamiliar; generic restaurant advice only.",
      "2": "Vaguely recalls the user has been there, but no event or details.",
      "3": "Recalls the celebration dinner OR a detail, but does not connect it to the current decision.",
      "4": "Recalls the celebration and at least one detail and uses them, with minor awkwardness or one small inaccuracy.",
      "5": "Naturally recalls the celebration and uses the risotto/gnocchi details to help the decision (e.g. 'steer your parents away from the risotto, and you finally get your gnocchi')."
    },
    "automatic_checks": [
      { "type": "must_not_match", "pattern": "never (been|heard of)", "cap": 1, "description": "Treating the restaurant as unknown." }
    ]
  },
  "replay": { "live_safe": true },
  "rationale": "Three weeks and two session boundaries separate the event from the probe, so context-window retention cannot explain success. The probe rewards bringing the right episode forward unprompted.",
  "authors": ["ChatBrat"],
  "added_in": "v0.1.0"
}
